{"issue": "9", "built": "fixture", "source_sha256": "fixture", "entries": [
 {"id":"a/art","word":"a","pos":"art","approved":true,"forms":["a","an"],"no_other_forms":false,"meaning":"indefinite article","alternatives":[],"examples":{"ste":[],"non_ste":[]}},
 {"id":"the/art","word":"the","pos":"art","approved":true,"forms":["the"],"no_other_forms":false,"meaning":"definite article","alternatives":[],"examples":{"ste":[],"non_ste":[]}},
 {"id":"and/conj","word":"and","pos":"conj","approved":true,"forms":["and"],"no_other_forms":false,"meaning":"","alternatives":[],"examples":{"ste":[],"non_ste":[]}},
 {"id":"then/adv","word":"then","pos":"adv","approved":true,"forms":["then"],"no_other_forms":false,"meaning":"","alternatives":[],"examples":{"ste":[],"non_ste":[]}},
 {"id":"if/conj","word":"if","pos":"conj","approved":true,"forms":["if"],"no_other_forms":false,"meaning":"","alternatives":[],"examples":{"ste":[],"non_ste":[]}},
 {"id":"you/pron","word":"you","pos":"pron","approved":true,"forms":["you"],"no_other_forms":false,"meaning":"","alternatives":[],"examples":{"ste":[],"non_ste":[]}},
 {"id":"your/adj","word":"your","pos":"adj","approved":true,"forms":["your"],"no_other_forms":false,"meaning":"","alternatives":[],"examples":{"ste":[],"non_ste":[]}},
 {"id":"it/pron","word":"it","pos":"pron","approved":true,"forms":["it"],"no_other_forms":false,"meaning":"","alternatives":[],"examples":{"ste":[],"non_ste":[]}},
 {"id":"its/adj","word":"its","pos":"adj","approved":true,"forms":["its"],"no_other_forms":false,"meaning":"","alternatives":[],"examples":{"ste":[],"non_ste":[]}},
 {"id":"is/v","word":"be","pos":"v","approved":true,"forms":["be","is","are","was","were"],"no_other_forms":true,"meaning":"","alternatives":[],"examples":{"ste":[],"non_ste":[]}},
 {"id":"to/prep","word":"to","pos":"prep","approved":true,"forms":["to"],"no_other_forms":false,"meaning":"","alternatives":[],"examples":{"ste":[],"non_ste":[]}},
 {"id":"of/prep","word":"of","pos":"prep","approved":true,"forms":["of"],"no_other_forms":false,"meaning":"","alternatives":[],"examples":{"ste":[],"non_ste":[]}},
 {"id":"with/prep","word":"with","pos":"prep","approved":true,"forms":["with"],"no_other_forms":false,"meaning":"","alternatives":[],"examples":{"ste":[],"non_ste":[]}},
 {"id":"by/prep","word":"by","pos":"prep","approved":true,"forms":["by"],"no_other_forms":false,"meaning":"","alternatives":[],"examples":{"ste":[],"non_ste":[]}},
 {"id":"for/prep","word":"for","pos":"prep","approved":true,"forms":["for"],"no_other_forms":false,"meaning":"","alternatives":[],"examples":{"ste":[],"non_ste":[]}},
 {"id":"remove/v","word":"remove","pos":"v","approved":true,"forms":["remove","removes","removed"],"no_other_forms":false,"meaning":"To take away","alternatives":[],"examples":{"ste":["REMOVE THE COVER."],"non_ste":[]}},
 {"id":"install/v","word":"install","pos":"v","approved":true,"forms":["install","installs","installed"],"no_other_forms":false,"meaning":"","alternatives":[],"examples":{"ste":[],"non_ste":[]}},
 {"id":"tighten/v","word":"tighten","pos":"v","approved":true,"forms":["tighten","tightens","tightened"],"no_other_forms":false,"meaning":"","alternatives":[],"examples":{"ste":[],"non_ste":[]}},
 {"id":"make/v","word":"make","pos":"v","approved":true,"forms":["make","makes","made"],"no_other_forms":false,"meaning":"","alternatives":[],"examples":{"ste":[],"non_ste":[]}},
 {"id":"do/v","word":"do","pos":"v","approved":true,"forms":["do","does","did","done"],"no_other_forms":false,"meaning":"","alternatives":[],"examples":{"ste":[],"non_ste":[]}},
 {"id":"refer/v","word":"refer","pos":"v","approved":true,"forms":["refer","refers","referred"],"no_other_forms":false,"meaning":"","alternatives":[],"examples":{"ste":[],"non_ste":[]}},
 {"id":"test/n","word":"test","pos":"n","approved":true,"forms":["test","tests"],"no_other_forms":false,"meaning":"A procedure to find a condition","alternatives":[],"examples":{"ste":["DO A TEST."],"non_ste":[]}},
 {"id":"test/v","word":"test","pos":"v","approved":false,"forms":["test"],"no_other_forms":false,"meaning":"","alternatives":[{"word":"do a test","pos":null}],"examples":{"ste":["DO A TEST OF THE SYSTEM."],"non_ste":["Test the system."]}},
 {"id":"cover/n","word":"cover","pos":"n","approved":true,"forms":["cover","covers"],"no_other_forms":false,"meaning":"","alternatives":[],"examples":{"ste":[],"non_ste":[]}},
 {"id":"screw/n","word":"screw","pos":"n","approved":true,"forms":["screw","screws"],"no_other_forms":false,"meaning":"","alternatives":[],"examples":{"ste":[],"non_ste":[]}},
 {"id":"pump/n","word":"pump","pos":"n","approved":true,"forms":["pump","pumps"],"no_other_forms":false,"meaning":"","alternatives":[],"examples":{"ste":[],"non_ste":[]}},
 {"id":"fuel/n","word":"fuel","pos":"n","approved":true,"forms":["fuel"],"no_other_forms":false,"meaning":"","alternatives":[],"examples":{"ste":[],"non_ste":[]}},
 {"id":"system/n","word":"system","pos":"n","approved":true,"forms":["system","systems"],"no_other_forms":false,"meaning":"","alternatives":[],"examples":{"ste":[],"non_ste":[]}},
 {"id":"valve/n","word":"valve","pos":"n","approved":true,"forms":["valve","valves"],"no_other_forms":false,"meaning":"","alternatives":[],"examples":{"ste":[],"non_ste":[]}},
 {"id":"dirty/adj","word":"dirty","pos":"adj","approved":true,"forms":["dirty","dirtier","dirtiest"],"no_other_forms":false,"meaning":"","alternatives":[],"examples":{"ste":[],"non_ste":[]}},
 {"id":"consult/v","word":"consult","pos":"v","approved":false,"forms":["consult"],"no_other_forms":false,"meaning":"","alternatives":[{"word":"refer","pos":"v"}],"examples":{"ste":["REFER TO THE MANUAL."],"non_ste":["Consult the manual."]}},
 {"id":"contaminated/adj","word":"contaminated","pos":"adj","approved":false,"forms":["contaminated"],"no_other_forms":false,"meaning":"","alternatives":[{"word":"dirty","pos":"adj"}],"examples":{"ste":["DISCARD THE DIRTY FILTER."],"non_ste":["Contaminated filters are discarded."]}},
 {"id":"utilize/v","word":"utilize","pos":"v","approved":false,"forms":["utilize"],"no_other_forms":false,"meaning":"","alternatives":[{"word":"use","pos":"v"}],"examples":{"ste":[],"non_ste":[]}},
 {"id":"use/v","word":"use","pos":"v","approved":true,"forms":["use","uses","used"],"no_other_forms":false,"meaning":"","alternatives":[],"examples":{"ste":[],"non_ste":[]}},
 {"id":"fitting/n","word":"fitting","pos":"n","approved":true,"forms":["fitting","fittings"],"no_other_forms":false,"meaning":"","alternatives":[],"examples":{"ste":[],"non_ste":[]}},
 {"id":"oil/n","word":"oil","pos":"n","approved":true,"forms":["oil"],"no_other_forms":false,"meaning":"","alternatives":[],"examples":{"ste":[],"non_ste":[]}},
 {"id":"replace/v","word":"replace","pos":"v","approved":true,"forms":["replace","replaces","replaced"],"no_other_forms":false,"meaning":"","alternatives":[],"examples":{"ste":[],"non_ste":[]}},
 {"id":"must/v","word":"must","pos":"v","approved":true,"forms":["must"],"no_other_forms":true,"meaning":"","alternatives":[],"examples":{"ste":[],"non_ste":[]}},
 {"id":"can/v","word":"can","pos":"v","approved":true,"forms":["can","could"],"no_other_forms":true,"meaning":"","alternatives":[],"examples":{"ste":[],"non_ste":[]}},
 {"id":"not/adv","word":"not","pos":"adv","approved":true,"forms":["not"],"no_other_forms":false,"meaning":"","alternatives":[],"examples":{"ste":[],"non_ste":[]}},
 {"id":"before/prep","word":"before","pos":"prep","approved":true,"forms":["before"],"no_other_forms":false,"meaning":"","alternatives":[],"examples":{"ste":[],"non_ste":[]}},
 {"id":"manual/n","word":"manual","pos":"n","approved":true,"forms":["manual","manuals"],"no_other_forms":false,"meaning":"","alternatives":[],"examples":{"ste":[],"non_ste":[]}},
 {"id":"than/conj","word":"than","pos":"conj","approved":true,"forms":["than"],"no_other_forms":false,"meaning":"","alternatives":[],"examples":{"ste":[],"non_ste":[]}}
]}
